{"id":"BOOT-11","source":{"path":"PROMPT.md","locator":"Official CTA adoption and foundational bootstrap / BOOT-11","content_identity":"sha256:6320883430f7817bf83d69cc48d6f8904463aff38315196529a46d24dec5641f"},"actor":"active consumer runtime","triggers":["full_install","operations_access_revalidation"],"scope":"current project canonical operations and active runtime adapter/selected prepared credential","dependencies":["BOOT-08","BOOT-09","Repository Bootstrap Contract","SEC-04"],"preconditions":["current_project_identity","canonical_operations_identity","selected_project_authorized_credential","configured_runtime_adapter"],"actions":["verify_runtime_credential_read","verify_runtime_credential_write","verify_signing_separately_if_required","repair_authorized_local_adapter_if_needed","give_precise_public_enrollment_instructions_if_human_action_required","reverify_after_human_action","synchronize_without_data_loss"],"postconditions":["runtime_credential_read_verified","runtime_credential_write_verified","local_changes_and_concurrent_writes_preserved"],"verification":"Attributable observations or sufficient effective-credential permission inspection through the configured adapter; signing separately where applicable.","prohibitions":["private_visibility_check","anonymous_read_as_credential_proof","foreign_credential_as_proof","force_reset_unrelated_repository","secret_values_in_user_instructions"],"unknown":"Keep affected read/write readiness unresolved; establish missing facts without claiming success.","failure":"Preserve actual effects; repair authorized local defects or explain a genuine human/provider dependency.","recovery":"Await actual human attachment/permission change when necessary, inspect resulting access and reverify before readiness.","semantic_clause":"| **BOOT-11** | The runtime can read and write `operations` with its prepared credentials, and synchronization preserves data. | Reuse the project-authorized credential selected/prepared under BOOT-08–BOOT-09; configure the active adapter and canonical local remote. Verify exact repository identity and both reading and writing using that credential and adapter, with signing verified separately where required. Do not check private visibility; public/anonymous reading or another credential's success does not prove this runtime's read/write access. If the credential does not work, attempt authorized local repair first; for a required human enrollment/permission change, give exact provider/namespace/repository instructions, the credential's public enrollment material or safe reference and minimal read/write permissions, await the action and reverify access before readiness. Fetch/fast-forward or reconcile safely; preserve local changes, conflicts and concurrent writes. Do not force/reset an unrelated consumer repository. A source with no auth does not exempt `operations` from these credential-based access requirements. |"}
